,index,Tags,Questions,Answers,Address,Views,Date_published
153,210,calculator,Compound Interest Calculator,Determine how your money can amplify using the power of compound interest.,https://www.bajajfinservmarkets.in/insurance/compound-interest-calculator.html,-,-
154,212,calculator,BMI Calculator,Use our BMI calculator to determine your weight category and plan your health routine accordingly.,https://www.bajajfinservmarkets.in/insurance/health-insurance/bmi-calculator.html,-,-
155,213,calculator,Calorie Calculator,Determine how many calories you should be eating per day to either maintain or lose your weight.,https://www.bajajfinservmarkets.in/insurance/health-insurance/calorie-calculator.html,-,-
156,194,calculator,Health Insurance Premium Calculator,Understand how much your health insurance will cost so that you can secure your and your family’s medical needs.,https://www.bajajfinservmarkets.in/insurance/health-insurance/health-insurance-premium-calculator/getGoingNow.html,-,-
157,200,calculator,Human Life Value Calculator,Know how much life insurance coverage you need based on your lifestyle habits and more.,https://www.bajajfinservmarkets.in/insurance/human-life-value-calculator-hlv.html,-,-
158,199,calculator,IDV Calculator,Calculate the Insured Declared Value (IDV) of your vehicle before buying a motor insurance plan.,https://www.bajajfinservmarkets.in/insurance/motor-insurance/idv-calculator.html,-,-
159,195,calculator,Travel Insurance Premium Calculator,Travel in mind? Don’t forget your travel insurance policy. Know the policy cost in a few clicks.,https://www.bajajfinservmarkets.in/insurance/travel-insurance/individual-travel-insurance.html,-,-
160,193,calculator,Bike Insurance Calculator,Calculate your two-wheeler insurance premium in just a few clicks.,https://www.bajajfinservmarkets.in/insurance/two-wheeler-insurance/bike-insurance-premium-calculator/vehicleRegistration.html,-,-
161,198,calculator,ULIP Risk Calculator,Calculate the risk involved in your chosen ULIP before investing in the policy.,https://www.bajajfinservmarkets.in/insurance/ulip/ulip-risk-calculator.html,-,-
162,197,calculator,Term Insurance Calculator,"Term insurance is an affordable life insurance plan. So, how much do you pay? Use the term insurance premium calculator to know the policy cost.",https://www.bajajfinservmarkets.in/li/term-insurance-calculator/#/GetQuoteDetails.html,-,-
163,203,calculator,Business Loan Calculator,"Do you need funds to sustain or expand your business? With our Business Loan calculator, determine your monthly repayments to make an informed decision.",https://www.bajajfinservmarkets.in/loans/business-loan/business-loan-emi-calculator.html,-,-
164,206,calculator,Business Loan Calculator for Doctors,We offer Business Loans for Doctors specifically. You can use this calculator to determine your EMIs and plan accordingly.,https://www.bajajfinservmarkets.in/loans/business-loan/business-loan-for-doctors/business-loan-emi-calculator-for-doctors.html,-,-
165,135,market,E-Way Bill,"The Electronic Way (E-way) bill is a document introduced under the GST regime. This bill is generated before transporting or shipping goods worth more than INR 50,000 within state or interstate. Read on to know more.",https://www.bajajfinservmarkets.in/loans/business-loan/e-way-bill.html,-,-
166,202,calculator,Home Loan EMI Calculator,Planning to buy a new house? Calculate your EMIs with ease using our Home Loan calculator.,https://www.bajajfinservmarkets.in/loans/home-loan/home-loan-emi-calculator.html,-,-
167,205,calculator,Loan Against Property Balance Transfer Calculator,"Are you looking to transfer your existing home loan to another lender? In that case, calculate your EMIs, that you will need to pay in the future, using the LAPBT calculator.",https://www.bajajfinservmarkets.in/loans/loan-against-property-balance-transfer/loan-against-property-balance-transfer-emi-calculator.html,-,-
168,204,calculator,MARKETS iCash Calculator,Quickly fix your personal financial shortfall with MARKETS iCash. Know how much you’d need to repay using this calculator and plan your finances accordingly.,https://www.bajajfinservmarkets.in/loans/markets-icash/emi-calculator.html,-,-
169,201,calculator,Personal Loan EMI Calculator,Use our Personal Loan EMI Calculator to calculate your monthly EMI and get a step closer to managing your finances  well.,https://www.bajajfinservmarkets.in/loans/personal-loan/personal-loan-emi-calculator.html,-,-
170,133,market,Budget,"From a bolstering the infrastructure and healthcare sector to laying a foundation for ""Atmanirbhar Bharat”, Government underlines their commitment towards functional reforms with Budget 2021. Read on to find out what you can bet on!",https://www.bajajfinservmarkets.in/markets-insights/budget.html,-,-
171,134,market,Tax Center,"From income tax slabs, tax reforms, ITR filing to tax calculations, Tax Center keeps you updated with what you need to know as a tax payer. Get access to income tax tools and articles, all at one place!",https://www.bajajfinservmarkets.in/markets-insights/income-tax.html,-,-
172,207,calculator,Income Tax Calculator,Making your tax calculations easy. Use this tool to determine the approx. amount that you are liable to pay as tax.,https://www.bajajfinservmarkets.in/markets-insights/income-tax/income-tax-calculator.html,-,-
173,209,calculator,PPF Calculator,Use our PPF calculator to perform even the most complex PPF-related calculations with ease.,https://www.bajajfinservmarkets.in/ppf-calculator.html,-,-
